{
  "schemaVersion":"1.0.0","evidenceId":"run-usage-1","observedAt":"2026-09-18T18:00:00Z",
  "executor":{"tokens":{"input":{"value":1000000,"unavailableReason":null},"output":{"value":200000,"unavailableReason":null},"cached":{"value":100000,"unavailableReason":null},"reasoning":{"value":50000,"unavailableReason":null},"total":{"value":1350000,"unavailableReason":null}},"actualTurns":{"value":4,"unavailableReason":null},"latencyMs":{"wall":{"value":12000,"unavailableReason":null},"model":{"value":9000,"unavailableReason":null}},"identity":{"providerRequested":"acme","modelRequested":"smart","providerResolved":"acme","modelResolved":"smart-1","resolutionConfidence":"alias"},"runtime":{"gooseVersion":"1.20.0","adapterName":"acme-adapter","adapterVersion":"2.1.0"}},
  "grader":{"tokens":{"input":{"value":200000,"unavailableReason":null},"output":{"value":50000,"unavailableReason":null},"cached":{"value":0,"unavailableReason":null},"reasoning":{"value":10000,"unavailableReason":null},"total":{"value":260000,"unavailableReason":null}},"actualTurns":{"value":1,"unavailableReason":null},"latencyMs":{"wall":{"value":4000,"unavailableReason":null},"model":{"value":3500,"unavailableReason":null}},"identity":{"providerRequested":"acme","modelRequested":"smart-1","providerResolved":"acme","modelResolved":"smart-1","resolutionConfidence":"exact"},"runtime":{"gooseVersion":"1.20.0","adapterName":"acme-adapter","adapterVersion":"2.1.0"}},
  "pricing":{"source":"https://pricing.example/models","sourceVersion":"2026-09-01","retrievedAt":"2026-09-18T17:00:00Z","effectiveFrom":"2026-09-01T00:00:00Z","effectiveTo":null,"currency":"USD","provider":"acme","model":"smart-1","rates":[{"category":"input","perMillionTokens":2},{"category":"output","perMillionTokens":8},{"category":"cached","perMillionTokens":0.5},{"category":"reasoning","perMillionTokens":5}]},
  "quality":{"value":0.9,"unavailableReason":null}
}
